{
  "report_id": "ISCR-C-0001-V1",
  "strategy_id": "ISPS-C-0001-V1",
  "project_id": "PRJ-20990101-DEMO",
  "content_id": "C-0001",
  "continuity_anchors": ["SUBJECT-WORLD", "PALETTE-A", "TYPE-SYSTEM-A"],
  "pages": [
    {
      "page_number": 1,
      "page_role": "COVER",
      "page_duty": "COVER_CLICK",
      "semantic_responsibility": "Create one truthful click reason",
      "visual_system_key": "SYSTEM-A",
      "background_asset_policy": "DISTINCT_BACKGROUND_REQUIRED",
      "background_source_checksum": "1111111111111111111111111111111111111111111111111111111111111111",
      "rendered_asset_checksum": "aaaaaaaaaaaaaaaaaaaaaaaaaaaaaaaaaaaaaaaaaaaaaaaaaaaaaaaaaaaaaaaa",
      "shot_signature": "ESTABLISHING-WIDE-FRONTAL",
      "composition_family": "TYPE_DOMINANT_COVER",
      "continuity_anchors_present": ["SUBJECT-WORLD", "PALETTE-A", "TYPE-SYSTEM-A"],
      "page_role_fulfilled": true,
      "mobile_readable": true,
      "difference_from_previous_verified": true
    },
    {
      "page_number": 2,
      "page_role": "PROBLEM",
      "page_duty": "VALUE_DELIVERY",
      "semantic_responsibility": "Name the audience problem",
      "visual_system_key": "SYSTEM-A",
      "background_asset_policy": "DISTINCT_BACKGROUND_REQUIRED",
      "background_source_checksum": "2222222222222222222222222222222222222222222222222222222222222222",
      "rendered_asset_checksum": "bbbbbbbbbbbbbbbbbbbbbbbbbbbbbbbbbbbbbbbbbbbbbbbbbbbbbbbbbbbbbbbb",
      "shot_signature": "TRANSITION-MEDIUM-LEFT",
      "composition_family": "EDITORIAL_SPLIT",
      "continuity_anchors_present": ["SUBJECT-WORLD", "PALETTE-A"],
      "page_role_fulfilled": true,
      "mobile_readable": true,
      "difference_from_previous_verified": true
    },
    {
      "page_number": 3,
      "page_role": "ANALYSIS",
      "page_duty": "VALUE_DELIVERY",
      "semantic_responsibility": "Explain the decision mechanism",
      "visual_system_key": "SYSTEM-A",
      "background_asset_policy": "DISTINCT_BACKGROUND_REQUIRED",
      "background_source_checksum": "3333333333333333333333333333333333333333333333333333333333333333",
      "rendered_asset_checksum": "cccccccccccccccccccccccccccccccccccccccccccccccccccccccccccccccc",
      "shot_signature": "DETAIL-CLOSE-RIGHT",
      "composition_family": "EVIDENCE_DOMINANT",
      "continuity_anchors_present": ["SUBJECT-WORLD", "TYPE-SYSTEM-A"],
      "page_role_fulfilled": true,
      "mobile_readable": true,
      "difference_from_previous_verified": true
    },
    {
      "page_number": 4,
      "page_role": "SUMMARY",
      "page_duty": "SUMMARY_CONVERSION",
      "semantic_responsibility": "Summarize the decision path and next action",
      "visual_system_key": "SYSTEM-A",
      "background_asset_policy": "DISTINCT_BACKGROUND_REQUIRED",
      "background_source_checksum": "4444444444444444444444444444444444444444444444444444444444444444",
      "rendered_asset_checksum": "dddddddddddddddddddddddddddddddddddddddddddddddddddddddddddddddd",
      "shot_signature": "RELATIONSHIP-WIDE-REVERSE",
      "composition_family": "SUMMARY_EDITORIAL",
      "continuity_anchors_present": ["SUBJECT-WORLD", "PALETTE-A", "TYPE-SYSTEM-A"],
      "page_role_fulfilled": true,
      "mobile_readable": true,
      "difference_from_previous_verified": true
    }
  ],
  "visual_style_continuity": "PASS",
  "page_duty_fulfillment": "PASS",
  "background_asset_diversity": "PASS",
  "shot_and_composition_diversity": "PASS",
  "narrative_progression": "PASS",
  "mobile_readability": "PASS",
  "duplicate_background_pairs": [],
  "duplicate_shot_pairs": [],
  "hard_blocks": [],
  "operator_approval_required": true,
  "result": "PASS_PENDING_OPERATOR",
  "run_id": "RUN-20990101-010203-DEMO",
  "schema_version": "1.0.0",
  "created_at": "2099-01-01T01:02:03.000Z"
}
